date,heading,heading_sentiment,price,url,body,body_sentiment
2018-08-14,Cramer: Tesla Inc (TSLA) CEO Tweet Will Not Receive SEC Disciplinary Action,3,356.41,https://stocknews.com/news/tsla-cramer-tesla-inc-tsla-ceo-tweet-will-not-receive-sec/,"
Tesla Inc (NASDAQ:TSLA) CEO Elon Musk will likely walk away from his latest Twitter controversy unscathed. That’s the take from CNBC’s Jim Cramer, who doesn’t believe Musk will be penalized for his tweet about taking the company private.  more
CNBC passes along what Cramer had to say about Tesla.
CNBC’s Jim Cramer warns Tesla critics about getting their hopes up that the federal government will penalize Elon Musk for his tweet about taking the electric auto maker private.
“If you’re waiting for the [Securities and Exchange Commission] to hammer Tesla, well let me just tell you, we’ll be on Mars” by then, Cramer said Tuesday on “Squawk on the Street.”
Last week, Musk raised eyebrows by sharing in a tweet that he was looking to take the company private at a certain price, and he also hinted that he had secured funding. While it’s an unconventional approach to delivering a major piece of news that raised a ton of eyebrows, Cramer notes that it’s par for the course when it comes to Musk.
“We keep expecting a certain level of convention, and [Musk’s] not going to give it to you,” Cramer said. “Therefore, you should stop looking for it.”
Tesla Inc shares were trading at $352.62 per share on Tuesday morning, down $3.79 (-1.06%). Year-to-date, TSLA has gained 13.26%, versus a 6.98% rise in the benchmark S&P 500 index during the same period.
TSLA currently has a StockNews.com POWR Rating of B (Buy), and is ranked #4 of 24 stocks in the Auto & Vehicle Manufacturers category.
Get access to our daily newsletters, Best Stocks List, POWR Ratings, and much more!Free for 14 days -- no credit card required!
Sign Up Now",3
2018-08-14,Tesla Inc (TSLA) CEO Working With Several Investment Groups on Going Private Transaction,3,356.41,https://stocknews.com/news/tsla-tesla-inc-tsla-ceo-working-with-several-investment-groups-on/,"
Tesla Inc (NASDAQ:TSLA) may in fact become a privater company before too long. Just a week after roiling the markets on social media, CEO Elon Musk headed back to Twitter to provide an update on where things stand. more
CNBC passes along what the Tesla chief had to say.
Elon Musk said Monday that he is working with Goldman Sachs and Silver Lake on taking Tesla private.
In a Twitter post, Musk said those two firms are acting as financial advisors, and he’s also working with Wachtell, Lipton, Rosen & Katz and Munger, Tolles & Olson as legal advisors.
Musk provided additional insight into what’s going on in a blog post on Monday. “I continue to have discussions with the Saudi fund, and I also am having discussions with a number of other investors. … It is appropriate to complete those discussions before presenting a detailed proposal to an independent board committee,” Musk wrote.
The Tesla honcho has received a ton of criticism for last week’s tweet on potentially taking the company private, and questions are still circulating about whether or not he violated any regulations while doing so.
Tesla Inc shares fell $0.01 (0.00%) in premarket trading Tuesday. Year-to-date, TSLA has gained 14.47%, versus a 6.61% rise in the benchmark S&P 500 index during the same period.
TSLA currently has a StockNews.com POWR Rating of B (Buy), and is ranked #4 of 24 stocks in the Auto & Vehicle Manufacturers category.
Get access to our daily newsletters, Best Stocks List, POWR Ratings, and much more!Free for 14 days -- no credit card required!
Sign Up Now",3
2018-08-14,"CEO Elon Musk tweeted, ""I'm excited to work with Silver Lake and Goldman Sachs as financial advisors, plus Wachtell, Lipton, Rosen & Katz and Munger, Tolles & Olson as legal advisors, on the proposal to take Tesla private.""",3,356.41,https://stocknews.com/news/tsla-ceo-elon-musk-tweeted-im-excited-to-work-with-silver/,"
Tesla Inc. designs, develops, manufactures, and sells electric vehicles, electric vehicle powertrain components, and stationary energy storage systems in the United States, China, Norway, and internationally. The company was founded in 2003 and is based in Palo Alto, California. View our full TSLA ticker page with ratings, news, and more.
Get access to our daily newsletters, Best Stocks List, POWR Ratings, and much more!Free for 14 days -- no credit card required!
Sign Up Now",4
2018-08-13,"CEO Elon Musk issues update on going private proposal, says managing director of Saudi Arabian sovereign wealth fund expressed support for funding a going private transaction for Tesla",3,355.49,https://stocknews.com/news/tsla-ceo-elon-musk-issues-update-on-going-private-proposal-says/,"
Tesla Inc. designs, develops, manufactures, and sells electric vehicles, electric vehicle powertrain components, and stationary energy storage systems in the United States, China, Norway, and internationally. The company was founded in 2003 and is based in Palo Alto, California. View our full TSLA ticker page with ratings, news, and more.
Get access to our daily newsletters, Best Stocks List, POWR Ratings, and much more!Free for 14 days -- no credit card required!
Sign Up Now",4
2018-08-12,Saudi Arabia’s sovereign wealth fund is in talks to invest in Tesla as part of Elon Musk’s plan to take the car maker private - Bloomberg citing sources,3,355.49,https://stocknews.com/news/tsla-saudi-arabias-sovereign-wealth-fund-is-in-talks-to-invest/,"
Tesla Inc. designs, develops, manufactures, and sells electric vehicles, electric vehicle powertrain components, and stationary energy storage systems in the United States, China, Norway, and internationally. The company was founded in 2003 and is based in Palo Alto, California. View our full TSLA ticker page with ratings, news, and more.
Get access to our daily newsletters, Best Stocks List, POWR Ratings, and much more!Free for 14 days -- no credit card required!
Sign Up Now",4
2018-08-11,Tesla Inc (TSLA) Media Buzz Could Vanish If It Goes Private,3,355.49,https://stocknews.com/news/tsla-tesla-inc-tsla-media-buzz-could-vanish-if-it-goes/,"
As a money-losing company, Tesla Inc (NASDAQ:TSLA) has long relied on shareholders and bondholders to buy into its future growth potential to fund its operations.more
That means the company needs lots of media buzz to keep interest flowing. So for, CEO Elon Musk has done an incredible job of that, but now he’s talking about taking the company private.
Without the daily share price fluctuations — not to mention earnings reports, analyst notes, and the like — how will that affect media buzz? Cullen Roche over at MarketWatch has some interesting thoughts on the matter:
Tesla has a $0 marketing budget. It relies entirely on word of mouth and organic news to generate buzz about the business. This is really interesting in the scope of the stock market because nothing generates buzz quite like Tesla’s stock and the way Musk talks about the stock. You could make a strong argument that Tesla’s most valuable asset is actually its public stock price because it is a near daily source of media attention.
Whether Tesla goes private or not is still up for debate. However, it does seem like a significant amount of attention will be lost if the company does go that route, and that would mean giving up a huge part of what brought the company here in the first place: hype.
Tesla Inc shares closed at $355.49 on Friday, up $3.04 (+0.86%). Year-to-date, TSLA has gained 14.18%, versus a 7.01% rise in the benchmark S&P 500 index during the same period.
TSLA currently has a StockNews.com POWR Rating of B (Buy), and is ranked #5 of 24 stocks in the Auto & Vehicle Manufacturers category.
Get access to our daily newsletters, Best Stocks List, POWR Ratings, and much more!Free for 14 days -- no credit card required!
Sign Up Now",3
2018-08-10,"Tesla shareholder files proposed class-action lawsuit accusing company, CEO Elon Musk of securities fraud - court filing - Reuters reporting",3,355.49,https://stocknews.com/news/tsla-tesla-shareholder-files-proposed-class-action-lawsuit-accusing-company-ceo-elon/,"
Tesla Inc. designs, develops, manufactures, and sells electric vehicles, electric vehicle powertrain components, and stationary energy storage systems in the United States, China, Norway, and internationally. The company was founded in 2003 and is based in Palo Alto, California. View our full TSLA ticker page with ratings, news, and more.
Get access to our daily newsletters, Best Stocks List, POWR Ratings, and much more!Free for 14 days -- no credit card required!
Sign Up Now",4
2018-08-10,Report: Tesla Inc (TSLA) Board To Hold Meeting With Bankers About Going Private,3,352.45,https://stocknews.com/news/tsla-teslas-board-to-meet-with-bankers-next-week-regarding-going/,"
If Tesla Inc (NASDAQ:TSLA) is in fact going to go private, then CEO Elon Musk may have to sit on the sidelines while a deal is hammered out. That’s the latest scuttlebutt in a week of never-ending drama surrounding the electric vehicle maker. more
CNBC has the latest on Tesla.
The Tesla board of directors plans to meet with financial advisors next week to formalize a process to explore Elon Musk’s take-private proposal, according to people familiar with the matter.
Musk announced via Twitter this week that he hopes to take the automaker private, in what would be one of the biggest such deals in history.
Musk’s tweet about potentially taking Tesla private disrupted the markets on Tuesday, and trading in shares of the company were temporarily halted. Shares have been gyrating ever since, and there remain questions on whether or not Musk broke any laws by broadcasting a major piece of company news on Twitter.
The Tesla honcho has reportedly talked with Saudi Arabia’s sovereign wealth fund about funding a potential deal.
Tesla Inc shares rose $5.08 (+1.44%) in premarket trading Friday. Year-to-date, TSLA has gained 13.20%, versus a 7.73% rise in the benchmark S&P 500 index during the same period.
TSLA currently has a StockNews.com POWR Rating of B (Buy), and is ranked #5 of 24 stocks in the Auto & Vehicle Manufacturers category.
Get access to our daily newsletters, Best Stocks List, POWR Ratings, and much more!Free for 14 days -- no credit card required!
Sign Up Now",3
2018-08-09,"Headlines that the SEC is conducting a broader inquiry of Tesla, and was already looking into the company ahead of Musk's take private tweet",3,370.34,https://stocknews.com/news/tsla-headlines-that-the-sec-is-conducting-a-broader-inquiry-of/,"
Tesla Inc. designs, develops, manufactures, and sells electric vehicles, electric vehicle powertrain components, and stationary energy storage systems in the United States, China, Norway, and internationally. The company was founded in 2003 and is based in Palo Alto, California. View our full TSLA ticker page with ratings, news, and more.
Get access to our daily newsletters, Best Stocks List, POWR Ratings, and much more!Free for 14 days -- no credit card required!
Sign Up Now",4
2018-08-09,Tesla Inc (TSLA) New A.I. Chips Just Months Away,3,370.34,https://stocknews.com/news/tsla-tesla-inc-tsla-new-a-i-chips-just-months-away/,"
On last week’s earnings call, Tesla Inc (NASDAQ:TSLA) CEO Elon Musk shared some insight on the company’s upcoming artificial intelligence processor. We now have an indication on when it will be released, courtesy of a tweet from Musk.   more
CNBC has the news on Tesla’s new processor.
Tesla CEO Elon Musk said that the next generation of hardware for autonomous driving will probably be available by early next year.
On last week’s earnings call, Musk touted the strengths of the coming Autopilot hardware, which will include an artificial intelligence processor developed by Tesla. But he didn’t say when the technology, which the company started working on about three years ago, would be available to car owners.
Musk provided the update in the form of an answer to a question posed on Twitter about when it would be released. “Probably 4 to 6 months. Those who order full self-driving get the upgrade at no cost. It isn’t needed just for enhanced Autopilot,” he wrote.
There’s no word on how the new hardware upgrades will be implemented as of yet.
Tesla Inc shares fell $3.14 (-0.85%) in premarket trading Thursday. Year-to-date, TSLA has gained 18.95%, versus a 7.88% rise in the benchmark S&P 500 index during the same period.
TSLA currently has a StockNews.com POWR Rating of B (Buy), and is ranked #5 of 24 stocks in the Auto & Vehicle Manufacturers category.
Get access to our daily newsletters, Best Stocks List, POWR Ratings, and much more!Free for 14 days -- no credit card required!
Sign Up Now",3
2018-08-09,SEC May Come Knocking on Tesla Inc (TSLA) CEO Elon Musk’s Door,3,370.34,https://stocknews.com/news/tsla-sec-may-come-knocking-on-tesla-inc-tsla-ceo-elon/,"
Tesla Inc (NASDAQ:TSLA) CEO Elon Musk may have to pencil in a meeting with the Securities and Exchange Commission in the near future. Musk’s tweet about potentially taking the company private opened up a bunch of questions, including whether or not he violated any laws on the books.   more
CNBC has the news on Tesla.
Elon Musk’s lawyers are probably pouring over rule 14e-8 of the Securities Exchange Act of 1934 right about now.
That regulation is the one the Tesla CEO may or may not have violated when he sent the markets into a frenzy and halted trading in Tesla’s shares after nonchalantly tweeting Tuesday that he was thinking about taking the electric car company private and had “funding secured,” securities lawyers say.
A number of former SEC enforcement lawyers have speculated that the agency has already opened up a probe on the matter. “I can’t imagine that the enforcement division hasn’t opened a file, that they are not calling his counsel or him and saying ‘we would like whatever papers you have about this, if you have written anything down, if you have talked to lenders, if you have materials about that we would like to see them,'” explained attorney Tom Gorman.
The aforementioned rule prohibits public announcements that are intended “to manipulate the market price of the stock of the bidder or subject company,” among other things.
Tesla Inc shares fell $4.31 (-1.16%) in premarket trading Thursday. Year-to-date, TSLA has gained 18.95%, versus a 7.88% rise in the benchmark S&P 500 index during the same period.
TSLA currently has a StockNews.com POWR Rating of B (Buy), and is ranked #5 of 24 stocks in the Auto & Vehicle Manufacturers category.
Get access to our daily newsletters, Best Stocks List, POWR Ratings, and much more!Free for 14 days -- no credit card required!
Sign Up Now",3
2018-08-08,Tesla Inc (TSLA) Runs Into Solar Production Issues,3,370.34,https://stocknews.com/news/tsla-tesla-inc-tsla-runs-into-solar-production-issues/,"
Tesla Inc (NASDAQ:TSLA) keeps running onto production issues, and we’re not just talking about with its vehicles either. There are problems afoot at its solar production facility as well, and that’s led to some delays. more
Reuters has the details on the problems Tesla is facing with solar production.
Tesla Inc’s (TSLA.O) production of solar roof tiles has been delayed by assembly-line problems at its new publicly subsidized factory and difficulties producing a product that satisfies the aesthetic demands of CEO Elon Musk, eight former and current employees of both companies told Reuters.
Repeated hold-ups since the Buffalo, New York plant opened last year have forced Tesla’s partner in the joint venture, Panasonic (6752.T), to seek other buyers for the components it had built to sell to Tesla, according to a Panasonic employee, a former Panasonic employee and a former Tesla employee. The issues have also rattled the faith of state officials in Tesla’s ability to deliver on investment and employment promises it made in exchange for $750 million in state subsidies.
Tesla has not offered up any specifics on the troubles it has faced at the Buffalo facility, but the company notes that tweaks are certainly needed before production is ramped up. “We are steadily ramping up Solar Roof production in Buffalo and are also continuing to iterate on the product design and production process,” the company explained to Reuters. “We plan to ramp production more toward the end of 2018.”
We’ll have to wait and see how that turns out, but the report from Reuters casts even more shade in the direction of Tesla’s often-criticized solar wing.
Tesla Inc shares were trading at $370.34 per share on Wednesday afternoon, down $9.23 (-2.43%). Year-to-date, TSLA has gained 18.95%, versus a 7.88% rise in the benchmark S&P 500 index during the same period.
TSLA currently has a StockNews.com POWR Rating of B (Buy), and is ranked #5 of 24 stocks in the Auto & Vehicle Manufacturers category.
Get access to our daily newsletters, Best Stocks List, POWR Ratings, and much more!Free for 14 days -- no credit card required!
Sign Up Now",3
2018-08-08,Trying to Understand if Tesla Inc (TSLA) Board is Liking the Go-Private Scenario,3,379.57,https://stocknews.com/news/tsla-trying-to-understand-if-tesla-inc-tsla-board-is-liking/,"
All seemed well on the Tesla Inc (NASDAQ:TSLA) front in the wake of last week’s positive earnings report, but that was just the calm before the storm. CEO Elon Musk hopped on the Twitter machine yesterday to hint that the company was going private, and the market is still trying to make sense of it.  more
Marketwatch shares some insight on the situation surrounding Tesla.
A statement from Tesla’s board members on Wednesday raises further questions following the shock tweet from Elon Musk that he wants to take the auto maker private.
The brief news release from Tesla board members—Brad Buss, Robyn Denholm, Ira Ehrenpreis, Antonio Gracias, Linda Johnson Rice, and James Murdoch—consisted of three sentences:
“Last week, Elon opened a discussion with the board about taking the company private. This included discussion as to how being private could better serve Tesla’s long-term interests, and also addressed the funding for this to occur. The board has met several times over the last week and is taking the appropriate next steps to evaluate this,” the brief release said.
So what does that mean for the future of Tesla as a publicly-traded company? That remains unclear, and the head-scratching and brow furrowing is continuing on the street as a result.
Tesla Inc shares were trading at $372.06 per share on Wednesday afternoon, down $7.51 (-1.98%). Year-to-date, TSLA has gained 19.50%, versus a 8.02% rise in the benchmark S&P 500 index during the same period.
TSLA currently has a StockNews.com POWR Rating of B (Buy), and is ranked #5 of 24 stocks in the Auto & Vehicle Manufacturers category.
Get access to our daily newsletters, Best Stocks List, POWR Ratings, and much more!Free for 14 days -- no credit card required!
Sign Up Now",3
2018-08-08,Headlines that the SEC is making inquires into Musk's taking private tweet,3,379.57,https://stocknews.com/news/tsla-headlines-that-the-sec-is-making-inquires-into-musks-taking/,"
Tesla Inc. designs, develops, manufactures, and sells electric vehicles, electric vehicle powertrain components, and stationary energy storage systems in the United States, China, Norway, and internationally. The company was founded in 2003 and is based in Palo Alto, California. View our full TSLA ticker page with ratings, news, and more.
Get access to our daily newsletters, Best Stocks List, POWR Ratings, and much more!Free for 14 days -- no credit card required!
Sign Up Now",4
2018-08-08,Needham & Co. reiterates Sell rating,3,379.57,https://stocknews.com/news/tsla-needham-co-reiterates-sell-rating/,"
Tesla Inc. designs, develops, manufactures, and sells electric vehicles, electric vehicle powertrain components, and stationary energy storage systems in the United States, China, Norway, and internationally. The company was founded in 2003 and is based in Palo Alto, California. View our full TSLA ticker page with ratings, news, and more.
Get access to our daily newsletters, Best Stocks List, POWR Ratings, and much more!Free for 14 days -- no credit card required!
Sign Up Now",4
2018-08-08,Berenberg sets PT at $500,3,379.57,https://stocknews.com/news/tsla-berenberg-sets-pt-at-500-76817465/,"
Tesla Inc. designs, develops, manufactures, and sells electric vehicles, electric vehicle powertrain components, and stationary energy storage systems in the United States, China, Norway, and internationally. The company was founded in 2003 and is based in Palo Alto, California. View our full TSLA ticker page with ratings, news, and more.
Get access to our daily newsletters, Best Stocks List, POWR Ratings, and much more!Free for 14 days -- no credit card required!
Sign Up Now",4
