date,heading,heading_sentiment,price,url,body,body_sentiment
2018-04-18,California Opens Investigation Into Tesla Inc's (TSLA) Workplace Environment,3,287.69,https://stocknews.com/news/tsla-california-opens-investigation-into-tesla-incs-tsla-workplace-environment/,"
That escalated quickly. Reports recently emerged alleging poor workplace safety practices at Tesla Inc (NASDAQ:TSLA), and the state of California is now going to start poking around and see if there’s anything to it. more
Bloomberg has the details on a new item that has appeared on the plate of Tesla.
California’s Division of Occupational Safety and Health said it has opened a new investigation into Tesla Inc. following a report about worker protections at the company’s lone auto plant in Fremont, California.
The state agency “takes seriously reports of workplace hazards and allegations of employers’ underreporting recordable work-related injuries and illnesses” and “currently has an open inspection at Tesla,” said Erika Monterroza, a spokeswoman for the state’s industrial relations department.
The report from earlier this week emanated from the Center for Investigative Reporting’s Reveal, and it alleged that the company was fudging numbers to make its safety records look better than they actually were. What’s more, the report indicated that founder and CEO Elon Musk’s personal preferences held more weight in some cases over potential hazards.
For its part, Tesla pushed back on the report in a blog post, referring to it as “an ideologically motivated attack by an extremist organization working directly with union supporters to create a calculated disinformation campaign against Tesla.”
Tesla Inc shares were trading at $293.01 per share on Wednesday afternoon, up $5.32 (+1.85%). Year-to-date, TSLA has declined -5.89%, versus a 1.91% rise in the benchmark S&P 500 index during the same period.
TSLA currently has a StockNews.com POWR Rating of C (Neutral), and is ranked #11 of 24 stocks in the Auto & Vehicle Manufacturers category.
Get access to our daily newsletters, Best Stocks List, POWR Ratings, and much more!Free for 14 days -- no credit card required!
Sign Up Now",3
2018-04-18,Tesla Inc (TSLA) Will Ramp Production Up To New Highs,3,287.69,https://stocknews.com/news/tsla-tesla-inc-tsla-will-ramp-production-up-to-new-highs/,"
Failure to reach production targets has led to a ton of criticism being leveled against Tesla Inc (NASDAQ:TSLA), but the company is taking steps to to make those issues a thing of the past. In short, it sounds like business is about to pick-up at the automaker’s Freemont assembly plant.   more
Bloomberg has the news on Tesla’s plans.
Tesla Inc. jumped after Chief Executive Officer Elon Musk laid out measures to boost production of his most crucial electric car and rein in expenses to achieve profitability.
The automaker’s Fremont, California, assembly plant will begin around-the-clock production to accelerate Model 3 output, Musk told employees in an email Tuesday. He acknowledged criticism that Tesla is “not a real company” until it generates profit and said this is a goal now that Tesla has more scale.
Tesla’s previous goal has been to reach a 5,000-a-week production target for the Model 3, but Musk indicates he wants to reach 6,000 per week by the end of June. Gene Munster, a managing partner at venture capital firm Loup Ventures, believes this is the kick in the pants that the carmaker has needed.
“This makes us more confident in Tesla’s ability to ramp Model 3 production to a level that will satisfy investors,” he wrote in a note to clients.
Tesla Inc shares were trading at $296.78 per share on Wednesday morning, up $9.09 (+3.16%). Year-to-date, TSLA has declined -4.68%, versus a 1.86% rise in the benchmark S&P 500 index during the same period.
TSLA currently has a StockNews.com POWR Rating of C (Neutral), and is ranked #11 of 24 stocks in the Auto & Vehicle Manufacturers category.
Get access to our daily newsletters, Best Stocks List, POWR Ratings, and much more!Free for 14 days -- no credit card required!
Sign Up Now",3
2018-04-18,Morgan Stanley cuts PT to $376 from $379,3,287.69,https://stocknews.com/news/tsla-morgan-stanley-cuts-pt-to-376-from-379/,"
Tesla Inc. designs, develops, manufactures, and sells electric vehicles, electric vehicle powertrain components, and stationary energy storage systems in the United States, China, Norway, and internationally. The company was founded in 2003 and is based in Palo Alto, California. View our full TSLA ticker page with ratings, news, and more.
Get access to our daily newsletters, Best Stocks List, POWR Ratings, and much more!Free for 14 days -- no credit card required!
Sign Up Now",4
2018-04-18,KeyBanc reiterates Hold rating,3,287.69,https://stocknews.com/news/tsla-keybanc-reiterates-hold-rating-76136157/,"
Tesla Inc. designs, develops, manufactures, and sells electric vehicles, electric vehicle powertrain components, and stationary energy storage systems in the United States, China, Norway, and internationally. The company was founded in 2003 and is based in Palo Alto, California. View our full TSLA ticker page with ratings, news, and more.
Get access to our daily newsletters, Best Stocks List, POWR Ratings, and much more!Free for 14 days -- no credit card required!
Sign Up Now",4
2018-04-18,Analyst: Ongoing Production Delays Will Push Tesla Inc (TSLA) To Tap Capital Markets,3,287.69,https://stocknews.com/news/tsla-analyst-ongoing-production-delays-will-push-tesla-inc-tsla-to/,"
The chorus continues to grow louder that Tesla Inc (NASDAQ:TSLA) will be hitting the capital markets before too long. Another team of analysts predicts that production delays will lead to Tesla having to raise funds before the year is through. more
Marketwatch shares the firm’s take on Tesla.
A second team of analysts now says that Tesla Inc. likely will raise equity or debt this year and face more production delays with its Model 3, despite the Silicon Valley car maker’s assurances to the contrary on both counts.
Analysts at Bernstein said they expect “production delays and the specter of a capital raise to dominate investor attention” on Tesla TSLA, +1.98% in the next two quarters. Further Model 3 delays would not necessarily “make or break Tesla,” they said, but they would intensify the company’s cash burn.
The analysts at Bernstein are holding firm on their price target of $265 for shares of Tesla, and they have the equivalent of a neutral rating in place. As they see it, the company needs to “materially” reduce near-term operational and capital expenses spending to avoid another capital raise.
Analysts at Goldman Sachs came forward to express similar sentiments about Tesla earlier this month, and the firm lowered its price target to $195 while doing so.
Tesla Inc shares rose $6.23 (+2.17%) in premarket trading Wednesday. Year-to-date, TSLA has declined -7.60%, versus a 1.65% rise in the benchmark S&P 500 index during the same period.
TSLA currently has a StockNews.com POWR Rating of C (Neutral), and is ranked #11 of 24 stocks in the Auto & Vehicle Manufacturers category.
Get access to our daily newsletters, Best Stocks List, POWR Ratings, and much more!Free for 14 days -- no credit card required!
Sign Up Now",3
2018-04-17,Company now internally targeting 3-4K Model 3 production rate next month and 6K by the end of June - Electrek,3,287.69,https://stocknews.com/news/tsla-company-now-internally-targeting-3-4k-model-3-production-rate-next/,"
Tesla Inc. designs, develops, manufactures, and sells electric vehicles, electric vehicle powertrain components, and stationary energy storage systems in the United States, China, Norway, and internationally. The company was founded in 2003 and is based in Palo Alto, California. View our full TSLA ticker page with ratings, news, and more.
Get access to our daily newsletters, Best Stocks List, POWR Ratings, and much more!Free for 14 days -- no credit card required!
Sign Up Now",4
2018-04-17,China will now allow U.S. electric car makers to setup in China without venture partner; timetable for rest of auto industry coming in future years,3,291.21,https://stocknews.com/news/tsla-china-will-now-allow-u-s-electric-car-makers-to-setup/,"
Tesla Inc. designs, develops, manufactures, and sells electric vehicles, electric vehicle powertrain components, and stationary energy storage systems in the United States, China, Norway, and internationally. The company was founded in 2003 and is based in Palo Alto, California. View our full TSLA ticker page with ratings, news, and more.
Get access to our daily newsletters, Best Stocks List, POWR Ratings, and much more!Free for 14 days -- no credit card required!
Sign Up Now",4
2018-04-17,"Tesla Inc (TSLA) Halts Model 3 Production To ""Improve Automation""",3,291.21,https://stocknews.com/news/tsla-tesla-inc-tsla-halts-model-3-production-to-improve-automation/,"
Tesla Inc (NASDAQ:TSLA) is already well behind its initial production goals for its new low-priced Model 3 electric sedan.more
The EV maker originally planned on making 5,000 Model 3’s by the end of 2017. It later extended that goal to the end of March 2018, before slashing it to 2,500.
Now, it hopes to reach that original goal level by the end of July, but that seems impossible at this point. And as BuzzFeed News reports, Tesla has actually halted production right now in order to install some upgrades to its systems:
Just a few days after Tesla CEO Elon Musk said he’s feeling optimistic about his ability to speed up production on the company’s vehicles, the assembly line for the Model 3 in the company’s Fremont, California, plant has been temporarily shut down — again.
The announcement of the four- to five-day production pause for the Model 3 came without warning, according to Tesla employees who spoke with BuzzFeed News. During the pause, workers are expected to use vacation days or stay home without pay; a small number of workers may be offered paid work elsewhere in the factory.
The company says the move is aimed at improving automation, which seems strange, considering CEO Elon Musk tweeted the following just a few days ago: “Yes, excessive automation at Tesla was a mistake. To be precise, my mistake. Humans are underrated.”
Tesla temporarily paused Model 3 production for the first time back in February, with the goal of boosting output once its systems come back online.
Tesla Inc shares fell $3.24 (-1.11%) in premarket trading Tuesday. Year-to-date, TSLA has declined -6.47%, versus a 0.58% rise in the benchmark S&P 500 index during the same period.
TSLA currently has a StockNews.com POWR Rating of C (Neutral), and is ranked #10 of 24 stocks in the Auto & Vehicle Manufacturers category.
Get access to our daily newsletters, Best Stocks List, POWR Ratings, and much more!Free for 14 days -- no credit card required!
Sign Up Now",3
2018-04-16,Tesla Inc (TSLA) May Need To Revamp Autopilot Strategy,3,291.21,https://stocknews.com/news/tsla-tesla-inc-tsla-may-need-to-revamp-autopilot-strategy/,"
Tesla Inc (NASDAQ:TSLA) has a number of items on its plate at the moment, ranging from production concerns to worries over its debt load, and the company may need to revamp another part of its strategy in the wake of recent developments. A recent fatal crash in California was followed by a public spat with the National Transporation Safety Board that shed a negative light on the carmaker, and the time may be now for Tesla to re-examine its autopilot ambitions.   more
Business Insider has some insight on what Tesla may need to do.
Autopilot is actually not Tesla’s biggest headache at the moment — sluggish production of the Model 3 sedan is. But Autopilot is turning into both a public-relations nightmare and an opportunity, a dynamic driven by the weak overall market performance of electric vehicles, which make up only about 1% of global sales. Self-driving cars are the cool new thing, and Musk isn’t going to miss out on that futuristic adventures, even as he has to yet again take to sleeping in Tesla’s factory floor in Fremont, CA to fix the Model 3’s problems.
David Friedman, Director of Cars and Product Policy and Analysis for Consumers Union, the advocacy division of Consumer Reports, notes that Tesla’s system may not be as good as offerings from rivals. “Their driver monitor system isn’t as good as some other systems in terms of assuring that someone is paying attention,” he notes.
While it’s unlikely the company would tap the brakes on autopilot completely at this point, it certainly seems like an appropriate time to make sure that any and all kinks have been worked out.
Tesla Inc shares were trading at $291.44 per share on Monday afternoon, down $8.90 (-2.96%). Year-to-date, TSLA has declined -6.39%, versus a 0.67% rise in the benchmark S&P 500 index during the same period.
TSLA currently has a StockNews.com POWR Rating of C (Neutral), and is ranked #10 of 24 stocks in the Auto & Vehicle Manufacturers category.
Get access to our daily newsletters, Best Stocks List, POWR Ratings, and much more!Free for 14 days -- no credit card required!
Sign Up Now",3
2018-04-16,Report: Tesla Inc (TSLA) Has Been Underreporting Worker Injuries,3,300.34,https://stocknews.com/news/tsla-report-tesla-inc-tsla-has-been-underreporting-worker-injuries/,"
The hits keep on coming from Tesla Inc (NASDAQ:TSLA), and we’re unfortunately not talking about the company suddenly knocking it out of the park on production goals. Yet another negative story has started making the rounds about the carmaker, and this one suggests there’s some creative record-keeping going on in regards to safety numbers.  more
CNBC passes along the details on a new report that paints Tesla in a negative light.
Electric vehicle maker Tesla has mislabeled and under-counted workers’ injuries to make its safety record look better than it was, according to a new investigative report by RevealNews.org.
“Company officials labeled toxic exposures, muscle strains and repetitive stress injuries as personal medical issues or minor accidents requiring only first aid, lowering its official injury count,” said the report.
Sources that spoke to Reveal indicate that there were safety compromises made at the company’s Fremont factory for incredibly curious reasons. According to the sources, CEO Elon Musk is not a big fan of the color yellow, and that resulted in the factory floor not having clearly marked pedestrian lanes. As opposed to the standard yellow, lanes were allegedly painted different shades of gray.
While the Reveal reporters seem to have done a thorough job with the investigation, Tesla has disputed the findings and notes that any past safety concerns have already been addressed and dealt with.
Tesla Inc shares were trading at $293.70 per share on Monday morning, down $6.64 (-2.21%). Year-to-date, TSLA has declined -5.67%, versus a 0.27% rise in the benchmark S&P 500 index during the same period.
TSLA currently has a StockNews.com POWR Rating of C (Neutral), and is ranked #10 of 24 stocks in the Auto & Vehicle Manufacturers category.
Get access to our daily newsletters, Best Stocks List, POWR Ratings, and much more!Free for 14 days -- no credit card required!
Sign Up Now",3
2018-04-13,Tesla Inc (TSLA) CEO Elon Musk Savagely Hints Company Will Be Cash-Flow Positive Ahead of Schedule,4,294.08,https://stocknews.com/news/tsla-tesla-inc-tsla-ceo-elon-musk-savagely-hints-company-will/,"
Tesla Inc (NASDAQ:TSLA) CEO Elon Musk has demonstrated yet again that he’s not shy about speaking up when he disagrees with something. This time, it was a report from The Economist that caught his attention, and Musk felt the need to hop on the Twitter machine to respond.   more
CNBC has the details on what the Tesla CEO had to say.
Elon Musk gave detailed financial guidance for Tesla — in a tweet at 1:11 a.m. PT Friday — boosting the electric car maker’s stock.
The tweet was a reply to The Economist.
The Economist posted that “Tesla will need to raise $2.5bn to $3bn this year, according to Jefferies, a bank.” Many hours later, Musk caught wind of what the publication had to say, and he responded while taking a shot at the outlet’s interest factor.
“The Economist used to be boring, but smart with a wicked dry wit. Now it’s just boring (sigh). Tesla will be profitable & cash flow+ in Q3 & Q4, so obv no need to raise money,” Musk wrote.
Tesla Inc shares were trading at $297.45 per share on Friday morning, up $3.37 (+1.15%). Year-to-date, TSLA has declined -4.46%, versus a 0.01% rise in the benchmark S&P 500 index during the same period.
TSLA currently has a StockNews.com POWR Rating of C (Neutral), and is ranked #10 of 24 stocks in the Auto & Vehicle Manufacturers category.
Get access to our daily newsletters, Best Stocks List, POWR Ratings, and much more!Free for 14 days -- no credit card required!
Sign Up Now",3
2018-04-13,Social Media Warning Signs,3,294.08,https://stocknews.com/news/tsla-social-media-warning-signs/,"
It’s quite the job we have here at StockNews.com in covering the sudden starts and stops of a volatile market. But more and more, social media is taking what would be just another day in the markets and adding new sizzle. While it can be entertaining, it can also be profitable. However, one has to be ready to pounce. For example, Tesla CEO Elon Musk loves to use Twitter, almost as much as President Trump these days. Sometimes, Mr. Musk is mocking a brokerage for giving bad commentary. This morning, he called out The Economist magazine for reporting an analyst call that said the company would likely need to raise $2.5-$3B. Mr. Musk replied with “The Economist used to be boring, but smart with a wicked dry wit. Now it’s just boring (sigh). Tesla will be profitable & cash flow+ in Q3 & Q4, so obv no need to raise money.” Maybe it’s me, but I tend to get a bit nervous when the CEO of a huge company feels the need to vent publicly. I get it’s the thing to do these days, but it just doesn’t seem like the right thing to do.more
Notes From Thursday’s Action
Homebuilders – once again did not participate in the big rally. Interest rates jumping, along with commodity prices may be part of the story – NVR Inc. (NVR), LGI Homes (LGIH), Lennar (LEN).
Financials looked solid in the rally – Goldman Sachs (GS), JP Morgan (JPM), PNC Financial (PNC), and CME Group (CME).
Retailers have been solid but we did see some names stumble on news today – Bed Bath & Beyond (BBBY) – earnings disappointments, LBrands (LB) – weak March sales.
Names That Lagged the Rally – Tesla (TSLA), McDonald’s (MCD), Simon Property Group (SPG), Kimberly-Clark (KMB), Netease (NTES), Facebook (FB), Bristol-Myers (BMY),
Airlines caught a bid on unconfirmed Berkshire rumors may be taking a bid in some of the airline names – Delta (DAL), Southwest Air (LUV).
Relative strength plays outperforming – Autohome (ATHM), Agios Pharmaceuticals (AGIO), Burlington Stores (BURL), Inogen Inc. (INGN), Penumbra (PEN), Argenx SE (ARGX), CoStar Group (CSGP), Netflix (NFLX), Humana (HUM), Verisign (VRSN), PVH Corp (PVH), Nvidia (NVDA), Intel (INTC), Costco (COST), 51 Job, Inc. (JOBS), Nutanix (NTNX), NetApp (NTAP), Loxo Oncology (LOXO), Amazon.com (AMZN),
Software continues to be one of the main areas of momentum during any market rally – Adobe Systems (ADBE), Splunk (SPLK), Palo Alto Networks (PANW), F5 Networks (FFIV), Red Hat (RHT), Proofpoint (PFPT).
Defense group under even more buyer focus on war-related headlines – Lockheed Martin (LMT), Northrop Grumman (NOC), Raytheon (RTN), Boeing (BA).
Advice for the Needy: Don’t Take Another Penny
Families and money matters can often cause rough situations, whether it’s parents and kids, siblings, estate matters, etc. We may have some family members that tend to be more needy than others, but who are also the most outspoken (funny how that is). The way to solve money situations can come down to one main philosophy. The person that is giving the monies is the person that is dictating what it shall or shall not be used for. The receiver either understands this rule or has the option of not having to. How they determine this is simple: don’t take another penny and then you can choose your own path. Being self-reliant is the only way one can eventually decide the path he/she will want to take. Anything else, it falls back to the giver to allocate what funds will be dispersed and for what purpose. These are lessons that may not have investing implications as we normally discuss, but if these decisions are made properly, investing can then be introduced into the family in a much more defined process. If this approach is too harsh, there is always the universal basic income approach (a hot topic today) and that is you give a specific amount of money to those in need in your family that they can do with as they please, but anything above that should be dictated as to where the monies shall be used.
Facebook for Money/Investing Topics
With Facebook so much in the news, I thought about what if there was a Facebook-like platform for all things money and investing. What would the information look like? My guess is that it would be broken down into people asking a lot of questions on things they don’t understand and then people offering up answers to things they never do themselves. Not to mention folks would only be talking about stuff they want others to know while concealing the reality of their actual financial situation. In a nutshell, basically just like Facebook is today. Money and investing is best left to those who live and breath the topic on a day-in, day-out basis. Find the best sources and you will be on the right course. Anything else is a waste of time.
Thanks for reading!
Get access to our daily newsletters, Best Stocks List, POWR Ratings, and much more!Free for 14 days -- no credit card required!
Sign Up Now",3
2018-04-13,CEO Elon Musk tweeted company will be profitable & cash flow+ in Q3 & Q4,3,294.08,https://stocknews.com/news/tsla-ceo-elon-musk-tweeted-company-will-be-profitable-cash/,"
Tesla Inc. designs, develops, manufactures, and sells electric vehicles, electric vehicle powertrain components, and stationary energy storage systems in the United States, China, Norway, and internationally. The company was founded in 2003 and is based in Palo Alto, California. View our full TSLA ticker page with ratings, news, and more.
Get access to our daily newsletters, Best Stocks List, POWR Ratings, and much more!Free for 14 days -- no credit card required!
Sign Up Now",4
2018-04-12,Tesla Inc (TSLA) In Hot Water With NTSB Following Comments,3,300.93,https://stocknews.com/news/tsla-tesla-inc-tsla-in-hot-water-with-ntsb-following-comments/,"
Another curious piece of news has reared its head in regards to Tesla Inc (NASDAQ:TSLA), and this time it has to do with the National Transportation Safety Board. Reports indicate that the NTSB asked the carmaker to step aside from its probe into a fatal crash with one of its vehicles, and that the conversation wasn’t exactly of the pleasant variety.   more
Bloomberg has the details on Tesla’s reported flap with the NTSB.
The National Transportation Safety Board told Tesla Inc. on Wednesday that the carmaker was being removed from the investigation of a fatal accident, prior to the company announcing it had withdrawn from it, according to a person familiar with the discussion.
NTSB Chairman Robert Sumwalt relayed the decision in a call to Tesla’s Elon Musk that was described as tense by the person because the chief executive officer was unhappy with the safety board’s action. NTSB is expected to make a formal announcement in a release later Thursday, said the person, who spoke on the condition of anonymity.
Reports indicate that the NTSB wasn’t pleased with Tesla’s public comments that the driver was at fault in the accident. While that may or may not be the case, the NTSB hasn’t wrapped up its investigation as of yet. Tesla has released a statement disputing that the call in question was testy in nature, and also explaining why it withdrew from the investigation.
“We believe in transparency, so an agreement that prevents public release of information for over a year is unacceptable,” the statement read in part.
Tesla Inc shares were trading at $297.58 per share on Thursday afternoon, down $3.35 (-1.11%). Year-to-date, TSLA has declined -4.42%, versus a 0.16% rise in the benchmark S&P 500 index during the same period.
TSLA currently has a StockNews.com POWR Rating of C (Neutral), and is ranked #9 of 24 stocks in the Auto & Vehicle Manufacturers category.
Get access to our daily newsletters, Best Stocks List, POWR Ratings, and much more!Free for 14 days -- no credit card required!
Sign Up Now",3
