date,heading,heading_sentiment,price,url,body,body_sentiment
2018-06-21,Tesla Inc (TSLA) Eyes Germany for Europe Gigafactory,3,362.22,https://stocknews.com/news/tsla-tesla-inc-tsla-eyes-germany-for-europe-gigafactory/,"
Tesla Inc (NASDAQ:TSLA) CEO Elon Musk has a habit of dropping company news on Twitter, and he just shared another interesting tidbit in response to a user question. Musk has shared which country is the leading candidate to be home to the company’s planned gigafactory in Europe. more
Marketwatch has the news on where Tesla may be headed.
Elon Musk, apparently undeterred by President Donald Trump’s warnings of rising crime, said Tuesday he is eyeing Germany as a potential site for Tesla Inc.’s planned European Gigafactory.
In a Tweet response to a question from a follower, the Tesla TSLA, -0.05% chief said Germany is a leading choice for the factory, which is expected to produce lithium-ion batteries that can be used in electric cars.
“Germany is a leading choice for Europe. Perhaps on the German-French border makes sense, near the Benelux countries,” Musk shared in response to a question. The company is still building out its US gigafactory in Nevada.
No specific timeline has been unveiled for Tesla’s European factory ambitions.
Tesla Inc shares fell $1.52 (-0.42%) in premarket trading Thursday. Year-to-date, TSLA has gained 16.34%, versus a 4.29% rise in the benchmark S&P 500 index during the same period.
TSLA currently has a StockNews.com POWR Rating of B (Buy), and is ranked #6 of 24 stocks in the Auto & Vehicle Manufacturers category.
Get access to our daily newsletters, Best Stocks List, POWR Ratings, and much more!Free for 14 days -- no credit card required!
Sign Up Now",3
2018-06-20,Tesla Inc (TSLA) Suing Former Employee Over Trade Secret Information Theft,2,362.22,https://stocknews.com/news/tsla-company-suing-a-former-employee-for-allegedly-hacking-trade-secrets/,"
Tesla Inc (NASDAQ:TSLA) has filed a lawsuit against a former employee over trade secret theft. The suit alleges that the former worker hacked confidential company info and shared it with third parties. more
Techcrunch has the details on Tesla’s case.
Tesla is suing a former employee for $1 million, alleging the man hacked the company’s confidential and trade secret information and transferred that information to third parties, according to court documents. The lawsuit also claims the employee leaked false information to the media.
The lawsuit against the former process technician Martin Tripp was filed Wednesday in Nevada. Tesla declined to comment on the lawsuit, which was first reported by CNBC.
According to the suit, Tripp “admitted to writing software that hacked Tesla’s manufacturing operating system (“MOS”) and to transferring several gigabytes of Tesla data to outside entities.” CEO Elon Musk has recently shared some ominous posts on social media about rogue employees, and he shared another today that indicates there could be more revelations to come.
“There is more, but the actions of a few bad apples will not stop Tesla from reaching its goals. With 40,000 people, the worst 1 in 1000 will have issues. That’s still ~40 people,” Musk shared.
Tesla Inc shares were trading at $362.22 per share on Wednesday afternoon, up $9.67 (+2.74%). Year-to-date, TSLA has gained 16.34%, versus a 3.84% rise in the benchmark S&P 500 index during the same period.
TSLA currently has a StockNews.com POWR Rating of B (Buy), and is ranked #5 of 24 stocks in the Auto & Vehicle Manufacturers category.
Get access to our daily newsletters, Best Stocks List, POWR Ratings, and much more!Free for 14 days -- no credit card required!
Sign Up Now",3
2018-06-19,Positive commentary on Mad Money show,3,352.55,https://stocknews.com/news/tsla-positive-commentary-on-mad-money-show-22918689/,"
Tesla Inc. designs, develops, manufactures, and sells electric vehicles, electric vehicle powertrain components, and stationary energy storage systems in the United States, China, Norway, and internationally. The company was founded in 2003 and is based in Palo Alto, California. View our full TSLA ticker page with ratings, news, and more.
Get access to our daily newsletters, Best Stocks List, POWR Ratings, and much more!Free for 14 days -- no credit card required!
Sign Up Now",4
2018-06-19,Employee Sabotage Just the Latest Controversy at Tesla Inc (TSLA),4,370.83,https://stocknews.com/news/tsla-ceo-elon-musk-has-emailed-coworkers-about-extensive-and-damaging/,"
If nothing else, the news surrounding Tesla Inc (NASDAQ:TSLA) tends to fall on the interesting side. Another story has emerged that certainly falls into that category, as it includes references to conspiracy and sabotage that have impacted the electric vehicle maker’s operations.   more
CNBC shares the details on this eyebrow-raising story about Tesla.
Tesla CEO Elon Musk sent an email to all employees on Monday morning about a factory fire, and seemed to reference possible sabotage.
Now, CNBC has learned that Musk also sent an e-mail to all employees at Tesla late on Sunday night alleging that he has discovered a saboteur in the company’s ranks.
According to Musk, the rogue employee is responsible for “quite extensive and damaging sabotage.” In the email to employees, he accuses the unnamed employee of “making direct code changes to the Tesla Manufacturing Operating System under false usernames and exporting large amounts of highly sensitive Tesla data to unknown third parties.”
Musk explained to employees that the investigation is ongoing and that he will keep them posted on developments as they arise.
Tesla Inc shares fell $5.22 (-1.41%) in premarket trading Tuesday. Year-to-date, TSLA has gained 19.10%, versus a 4.05% rise in the benchmark S&P 500 index during the same period.
TSLA currently has a StockNews.com POWR Rating of B (Buy), and is ranked #7 of 24 stocks in the Auto & Vehicle Manufacturers category.
Get access to our daily newsletters, Best Stocks List, POWR Ratings, and much more!Free for 14 days -- no credit card required!
Sign Up Now",3
2018-06-18,Tesla Inc (TSLA) CEO Elon Musk Issues New Warning to Short-Sellers,3,358.17,https://stocknews.com/news/tsla-tesla-inc-tsla-ceo-elon-musk-issues-new-warning-to/,"
As Tesla Inc (NASDAQ:TSLA) CEO Elon Musk sees it, short sellers are playing with fire by betting against his company. He hopped on social media over the weekend to advise that their positions may be in peril over the next few weeks. more
CNBC shares Musk’s warning for Tesla short sellers.
Tesla CEO and chairman Elon Musk went after shorts on Twitter over the weekend. He generally warned investors selling his electric vehicle venture short that they have about 3 weeks to cover if they don’t want to lose their money.
Tesla stock has rallied more than 20 percent since the company’s early June annual shareholder meeting at which Chairman and CEO Elon Muskpromised profitability in the third quarter, and trended more than 4 percent higher through last week after Tesla announced layoffs on Tuesday June 12th. Last week, Elon Musk bought around 72,000 Tesla shares, spending nearly $25 million to do so.
“They have about three weeks before their short position explodes,” Musk wrote. There has been a lot of volatility in Tesla share prices this year, much of which has been a direct result of negative headlines.
Musk hasn’t been shy about pushing back against those headlines, and the market seems to be agreeing with him lately. We’ll have to wait and see if that lasts if another batch of negative headlines hits the wires.
Tesla Inc shares were trading at $368.64 per share on Monday afternoon, up $10.47 (+2.92%). Year-to-date, TSLA has gained 18.40%, versus a 3.92% rise in the benchmark S&P 500 index during the same period.
TSLA currently has a StockNews.com POWR Rating of B (Buy), and is ranked #7 of 24 stocks in the Auto & Vehicle Manufacturers category.
Get access to our daily newsletters, Best Stocks List, POWR Ratings, and much more!Free for 14 days -- no credit card required!
Sign Up Now",3
2018-06-18,Cramer: Tesla Inc (TSLA) CEO Elon Musk a Master in Fighting Short-Sellers,3,358.17,https://stocknews.com/news/tsla-cramer-tesla-inc-tsla-ceo-elon-musk-a-master-in/,"
Tesla Inc (NASDAQ:TSLA) remains one of the most shorted stocks on the street, but CEO Elon Musk hasn’t been shy about pushing back against those bets. According to one financial pundit, what he’s been doing is working like a charm.  more
CNBC has some insight into the Tesla CEO’s response for short sellers.
Elon Musk is “masterful” in the way he fights back against the short sellers of Tesla stock, CNBC’s Jim Cramer said Thursday.
“You can’t lay a glove on him [Musk]. He floats like a butterfly, stings like a bee,” said Cramer, paraphrasing the famous quote from the late boxer Muhammad Ali.
Just last week, an SEC filing revealed that Musk had snapped up another 72,500 shares of the electric automaker. This comes in the wake of a number of negative headlines, many of which Musk has personally pushed back against, including questions about the company’s productivity and cash flow position. As Cramer sees it, Musk has been providing a clinic on how to respond to shorts.
“I remember when I was a hedge fund manager there periodically would be these companies where they knew how to handle the shorts,” Cramer added. “No one has been as masterful. Elon Musk is masterful. He’ll take the shorts up there with his rocket to Mars.”
Tesla Inc shares fell $1.92 (-0.54%) in premarket trading Monday. Year-to-date, TSLA has gained 15.04%, versus a 4.26% rise in the benchmark S&P 500 index during the same period.
TSLA currently has a StockNews.com POWR Rating of B (Buy), and is ranked #7 of 24 stocks in the Auto & Vehicle Manufacturers category.
Get access to our daily newsletters, Best Stocks List, POWR Ratings, and much more!Free for 14 days -- no credit card required!
Sign Up Now",4
2018-06-18,Video from actress Mary McCormack over the weekend called attention to her husband's Tesla Model S that caught fire while he was driving in the Los Angeles area,3,358.17,https://stocknews.com/news/tsla-video-from-actress-mary-mccormack-over-the-weekend-called-attention/,"
Tesla Inc. designs, develops, manufactures, and sells electric vehicles, electric vehicle powertrain components, and stationary energy storage systems in the United States, China, Norway, and internationally. The company was founded in 2003 and is based in Palo Alto, California. View our full TSLA ticker page with ratings, news, and more.
Get access to our daily newsletters, Best Stocks List, POWR Ratings, and much more!Free for 14 days -- no credit card required!
Sign Up Now",4
2018-06-15,Tesla Inc (TSLA) Layoffs All About the Company’s Cash Crunch,3,357.72,https://stocknews.com/news/tsla-tesla-inc-tsla-layoffs-all-about-the-companys-cash-crunch/,"
Tesla Inc (NASDAQ:TSLA) has announced that it will be reducing its workforce by 9 percent, and reaction has been mixed. CEO Elon Musk has referred to it as a simple restructuring, but some critics believes it has more to do with the company’s cash problems. more
Business Insider has some insight into the situation at hand for Tesla.
The layoffs Tesla announced Tuesday shouldn’t come as a surprise. Similarly, you shouldn’t be shocked if the company makes other dramatic moves in the coming months.
You see, Tesla CEO Elon Musk is caught in a kind of bind. His company is hemorrhaging cash as it has been struggling to ramp up production of its new Model 3 car. The company has said it won’t start generating profits from the vehicle until it’s making 5,000 of them a week; at last check, it could sustainably make only 3,500 a week.
Investors have taken notice of Tesla’s seemingly unquenchable thirst for cash, and plenty of concerns have been raised about whether the company will be able to continue at its current cash burn rate. That’s led to a belief that the company will have to raise capital again, but Musk believes the company will be generating positive cash flow by Q3.
Only time will tell which perspective is correct on Tesla, but you can rest assured that a ton of analysts have their eyes on the company to pounce on red flags as they emerge.
Tesla Inc shares were trading at $355.64 per share on Friday morning, down $2.08 (-0.58%). Year-to-date, TSLA has gained 14.23%, versus a 3.78% rise in the benchmark S&P 500 index during the same period.
TSLA currently has a StockNews.com POWR Rating of B (Buy), and is ranked #8 of 24 stocks in the Auto & Vehicle Manufacturers category.
Get access to our daily newsletters, Best Stocks List, POWR Ratings, and much more!Free for 14 days -- no credit card required!
Sign Up Now",3
2018-06-15,Short-Sellers Remain Defiant in Battle Against Tesla Inc (TSLA),3,357.72,https://stocknews.com/news/tsla-short-sellers-remain-defiant-in-battle-against-tesla-inc-tsla/,"
There has been plenty of volatility in shares of Tesla Inc (NASDAQ:TSLA) this year, but the negative sentiment that surrounded the company for much of it seems to be leveling out. However, some investors are standing firm in their position that all is not well with the electric vehicle maker.  more
CNBC has the details on short seller sentiment on Tesla.
It’s been a rough few weeks for investors betting against Tesla, one of the most-shortedstocks in the United States.
Tesla stock has rallied almost 17 percent since the company’s early June annual shareholder meeting at which Chairman and CEO Elon Musk promised profitability in the third quarter. Shares kept trending higher this week, rising slightly after Tesla announced plans to lay off 9 percent of its workforce. Musk added $25 million worth of shares to his personal holdings.
Tesla’s recent restructuring and layoffs has been viewed as a positive by the market as a whole, but short sellers see another red flag. As they see it, it’s just further evidence that the company is in a cash crunch. What’s more, some short sellers believe Tesla will have a hard time getting their cash calls answered if they need to go that route.
Kynikos Associates founder Jim Chanos is among those in the bearish camp on Tesla, and he explained to CNBC what his concerns are with the company. “The company is not profitable from operations. The company will … do a lot of one-time items, we believe, to show a GAAP profit in the third quarter. But they are just that, one-time items,” he said. “The basic problem is that [Musk] is making the cars at not enough of a gross margin to make money — and that’s before the competition rolls out, which is late this year and early next year.”
Tesla Inc shares were trading at $353.60 per share on Friday morning, down $4.12 (-1.15%). Year-to-date, TSLA has gained 13.57%, versus a 3.98% rise in the benchmark S&P 500 index during the same period.
TSLA currently has a StockNews.com POWR Rating of B (Buy), and is ranked #8 of 24 stocks in the Auto & Vehicle Manufacturers category.
Get access to our daily newsletters, Best Stocks List, POWR Ratings, and much more!Free for 14 days -- no credit card required!
Sign Up Now",3
2018-06-14,Analyst: Tesla Inc (TSLA) Model 3 Cancellation Rate Worse Than Wall Street Imagines,2,357.72,https://stocknews.com/news/tsla-analyst-tesla-inc-tsla-model-3-cancellation-rate-worse-than/,"
While the general sentiment surrounding Tesla Inc (NASDAQ:TSLA) seems to be trending back in the positive direction, not all analysts are completely convinced. We can add Vertical Group’s Gordon Johnson to the camp of the thoroughly unconvinced, as he has dropped his already street-low price target even lower. more
Zero Hedge passes along the analyst’s incredibly bearish take.
One main reason: according to Johnson’s calculations, the cancellation rate on Model 3 is a disastrous 66%, up 33% YTD, or as Gordon says, “Boy… that’s a Lot of Model 3 Cancellations.” Here are the details from Gordon:
Our work (Ex. 1) implies a 66% cancellation rate for the “euphoric” day-1 Model 3 reservations of ~140K. When applying this figure to our est. for 582K in gross reservations through mid-Apr. (i.e., 518K in gross reservations 7/31/17 + 7.55K/month in new reservations 7/31/17-to-4/15/18 [or 64K] to account for a monthly cancellation rate of 1% as of 7/31/17), we calculate sales from 582K in early Model 3 reservations of just 197K – we remind our readers that in mid-Apr. ’18, TSLA sent out configuration invites to US-based non-owners who made reservations one day after reservations opened up to the public (i.e., 4/1/16); from this, one can imply in mid-Apr. ’18 TSLA had fully exhausted Model 3 reservations made 3/31/16 (i.e., day one); furthermore, as of mid-Apr. ’18, all US-based owner reservations were complete.
In addition to showing his math for his estimated cancellation rate, Johnson has also provided a new valuation target for the electric vehicle maker. “Applying a 0.725x multiple to our new 2020 rev est. of $21.7bn (Street $34.7bn), our year-end 2019 price objective edges modestly lower to $93/share (-73% downside from today’s closing price) from $99/share previously.”
That would be a stunning drop – to say the least – from Tesla’s current price point. We’ll have to wait and see if Johnson’s crystal ball proves to be accurate or not.
Tesla Inc shares were trading at $357.72 per share on Thursday afternoon, up $12.94 (+3.75%). Year-to-date, TSLA has gained 14.89%, versus a 4.87% rise in the benchmark S&P 500 index during the same period.
TSLA currently has a StockNews.com POWR Rating of B (Buy), and is ranked #5 of 24 stocks in the Auto & Vehicle Manufacturers category.
Get access to our daily newsletters, Best Stocks List, POWR Ratings, and much more!Free for 14 days -- no credit card required!
Sign Up Now",3
2018-06-14,Vertical Group cuts PT to $93 from $99,3,344.78,https://stocknews.com/news/tsla-vertical-group-cuts-pt-to-93-from-99/,"
Tesla Inc. designs, develops, manufactures, and sells electric vehicles, electric vehicle powertrain components, and stationary energy storage systems in the United States, China, Norway, and internationally. The company was founded in 2003 and is based in Palo Alto, California. View our full TSLA ticker page with ratings, news, and more.
Get access to our daily newsletters, Best Stocks List, POWR Ratings, and much more!Free for 14 days -- no credit card required!
Sign Up Now",4
2018-06-13,CEO Elon Musk discloses purchase of 72K shares in the $340s,3,342.77,https://stocknews.com/news/tsla-ceo-elon-musk-discloses-purchase-of-72k-shares-in-the/,"
Tesla Inc. designs, develops, manufactures, and sells electric vehicles, electric vehicle powertrain components, and stationary energy storage systems in the United States, China, Norway, and internationally. The company was founded in 2003 and is based in Palo Alto, California. View our full TSLA ticker page with ratings, news, and more.
Get access to our daily newsletters, Best Stocks List, POWR Ratings, and much more!Free for 14 days -- no credit card required!
Sign Up Now",4
2018-06-13,"Demand for Nickel Booming for Tesla Inc (TSLA), Other EV Manufacturers",3,342.77,https://stocknews.com/news/tsla-demand-for-nickel-booming-for-tesla-inc-tsla-other-ev/,"
As Tesla Inc (NASDAQ:TSLA) and other automakers roll electric vehicles off the assembly line, demand for minerals used to make batteries naturally soars. That’s having a ripple effect in the mining industry, and one company is taking steps to deal with the spike. more
Investor’s Business Daily has the news on a mineral that has been flying off the shelves.
As Tesla (TSLA), General Motors (GM), Ford Motor (F) and Fiat Chrysler (FCAU) accelerate electric vehicle production, Brazilian mining giant Vale (VALE) will invest roughly $1.54 billion to launch underground nickel mining operations in Canada to meet booming demand for minerals used in EV batteries.
Vale’s Voisey’s Bay nickel move came as that project was nearing the end of its open-pit life, Bloomberg said. The bet on underground mining will extend the life of the mine by 15 years and create 1,700 direct jobs. Construction is likely to start this summer, with operations kicking off in April 2021.
At the present time, electric vehicles account for roughly three percent of the auto market. According to industry forecasts, that number will surge to between 40 and 50 percent on a worldwide basis by 2040.
That should be good news for miners, and Vale is proactively getting ready.
Tesla Inc shares were trading at $343.19 per share on Wednesday morning, up $0.42 (+0.12%). Year-to-date, TSLA has gained 10.23%, versus a 5.04% rise in the benchmark S&P 500 index during the same period.
TSLA currently has a StockNews.com POWR Rating of B (Buy), and is ranked #8 of 24 stocks in the Auto & Vehicle Manufacturers category.
Get access to our daily newsletters, Best Stocks List, POWR Ratings, and much more!Free for 14 days -- no credit card required!
Sign Up Now",3
2018-06-13,Tesla Inc (TSLA) Pulls Out of Home Depot Solar Partnership,3,342.77,https://stocknews.com/news/tsla-tesla-inc-tsla-pulls-out-of-home-depot-solar-partnership/,"
Tesla Inc (NASDAQ:TSLA) has announced another change, and this one has nothing to do with its electric vehicles or solving any production issues. This time around, changes are coming to the solar side of the business. more
CNBC has the details on Tesla’s move.
Tesla is ditching Home Depot as a sales partner for its residential clean energy products, CEO Elon Musk revealed in an e-mail to his employees on Tuesday. The move is part of a broader restructuring of the company which also entails layoffs of about 9 percent of the Tesla workforce, not including hourly production associates involved in manufacturing.
Company CEO Elon Musk explained the decision in an email to employees. “In addition to this company-wide restructuring, we’ve decided not to renew our residential sales agreement with Home Depot in order to focus our efforts on selling solar power in Tesla stores and online,” he wrote. “The majority of Tesla employees working at Home Depot will be offered the opportunity to move over to Tesla retail locations.”
As for the layoffs, they are expected to begin this week and be wrapped up rather quickly.
Tesla Inc shares fell $0.77 (-0.22%) in premarket trading Wednesday. Year-to-date, TSLA has gained 10.09%, versus a 4.94% rise in the benchmark S&P 500 index during the same period.
TSLA currently has a StockNews.com POWR Rating of B (Buy), and is ranked #8 of 24 stocks in the Auto & Vehicle Manufacturers category.
Get access to our daily newsletters, Best Stocks List, POWR Ratings, and much more!Free for 14 days -- no credit card required!
Sign Up Now",4
2018-06-12,Tesla Inc (TSLA) Restructuring Will Lead to Job Cuts,3,342.77,https://stocknews.com/news/tsla-tesla-to-layoff-roughly-9-of-workforce-as-part-of/,"
Tesla Inc (NASDAQ:TSLA) CEO Elon Musk has hinted that changes are coming to Tesla, and we now have clarity on what he meant by that. A big round of layoffs is on the horizon for the electric vehicle maker as it attempts to become leaner and more efficient.  more
Electrek has the news on Tesla.
Last month, Tesla CEO Elon Musk announced a vague plan to “restructure” the company in order to achieve profitability during the second half of the year.
Following the announcement, Electrek has now learned of a round of layoffs currently ongoing at Tesla, which could see as much as 9% of the workforce leave the company.
For round numbers, Tesla has more than 30,000 employees, which means that around 3,000 jobs could be eliminated when all is said and done. Musk provided more clarity on the decision making process in an email to employees.
“We made these decisions by evaluating the criticality of each position, whether certain jobs could be done more efficiently and productively, and by assessing the specific skills and abilities of each individual in the company,” he wrote. “As you know, we are also continuing to flatten our management structure to help us communicate better, eliminate bureaucracy and move faster.”
Tesla Inc shares were trading at $342.77 per share on Tuesday afternoon, up $10.67 (+3.21%). Year-to-date, TSLA has gained 10.09%, versus a 4.94% rise in the benchmark S&P 500 index during the same period.
TSLA currently has a StockNews.com POWR Rating of B (Buy), and is ranked #7 of 24 stocks in the Auto & Vehicle Manufacturers category.
Get access to our daily newsletters, Best Stocks List, POWR Ratings, and much more!Free for 14 days -- no credit card required!
Sign Up Now",3
2018-06-12,KeyBanc reiterates Hold rating,3,332.10,https://stocknews.com/news/tsla-keybanc-reiterates-hold-rating-20986408/,"
Tesla Inc. designs, develops, manufactures, and sells electric vehicles, electric vehicle powertrain components, and stationary energy storage systems in the United States, China, Norway, and internationally. The company was founded in 2003 and is based in Palo Alto, California. View our full TSLA ticker page with ratings, news, and more.
Get access to our daily newsletters, Best Stocks List, POWR Ratings, and much more!Free for 14 days -- no credit card required!
Sign Up Now",4
